{"n": 1, "ns": "1", "loaded": true, "filename": "1.two-sum.py", "file": "#\n# [1] Two Sum\n#\n# https://leetcode.com/problems/two-sum\n#\n# Easy (33.84%)\n# Total Accepted:    \n# Total Submissions: \n# Testcase Example:  '[3,2,4]\\n6'\n#\n# Given an array of integers, return indices of the two numbers such that they\n# add up to a specific target.\n# \n# You may assume that each input would have exactly one solution, and you may\n# not use the same element twice.\n# \n# \n# Example:\n# \n# Given nums = [2, 7, 11, 15], target = 9,\n# \n# Because nums[0] + nums[1] = 2 + 7 = 9,\n# return [0, 1].\n# \n# \n#\nclass Solution(object):\n    def twoSum(self, nums, target):\n        \"\"\"\n        :type nums: List[int]\n        :type target: int\n        :rtype: List[int]\n        \"\"\"\n        \n", "title": "Two Sum", "url": "https://leetcode.com/problems/two-sum", "difficulty": "Easy", "ac_rate": "33.84", "total_ac": "NaN", "total_sub": "NaN", "test_code": "'[3,2,4]\\n6'", "description": "Given an array of integers, return indices of the two numbers such that they add up to a specific target.\n\nYou may assume that each input would have exactly one solution, and you may not use the same element twice.\n\n\nExample:\n\nGiven nums = [2, 7, 11, 15], target = 9,\n\nBecause nums[0] + nums[1] = 2 + 7 = 9,\nreturn [0, 1]."}